film_id,title,description,language_id,rental_duration,rental_rate,length,replacement_cost,rating,special_features
309,Feud frogmen,A brilliant reflection of a database administrator and a mad cow who must chase a woman in the canadian rockies,1,6,0.99,98,29.99,R,"Trailers,commentaries,deleted scenes,behind the scenes"
310,Fever empire,A insightful panorama of a cat and a boat who must defeat a boat in the gulf of mexico,1,5,4.99,158,20.99,R,"Commentaries,deleted scenes"
311,Fiction christmas,A emotional yarn of a a shark and a student who must battle a robot in an abandoned mine shaft,1,4,0.99,72,14.99,PG,"Trailers,commentaries,deleted scenes,behind the scenes"
312,Fiddler lost,A boring tale of a squirrel and a dog who must challenge a madman in the gulf of mexico,1,4,4.99,75,20.99,R,"Deleted scenes,behind the scenes"
313,Fidelity devil,A awe-inspiring drama of a technical writer and a composer who must reach a pastry chef in a u-boat,1,5,4.99,118,11.99,G,"Trailers,deleted scenes,behind the scenes"
314,Fight jawbreaker,A intrepid panorama of a womanizer and a girl who must escape a girl in a manhattan penthouse,1,3,0.99,91,13.99,R,"Trailers,commentaries,deleted scenes,behind the scenes"
315,Finding anaconda,A fateful tale of a database administrator and a girl who must battle a squirrel in new orleans,1,4,0.99,156,10.99,R,"Trailers,commentaries"
316,Fire wolves,A intrepid documentary of a frisbee and a dog who must outrace a lumberjack in nigeria,1,5,4.99,173,18.99,R,Trailers
317,Fireball philadelphia,A amazing yarn of a dentist and a a shark who must vanquish a madman in an abandoned mine shaft,1,4,0.99,148,25.99,PG,"Trailers,commentaries,behind the scenes"
318,Firehouse vietnam,A awe-inspiring character study of a boat and a boy who must kill a pastry chef in the sahara desert,1,7,0.99,103,14.99,G,"Commentaries,deleted scenes"
319,Fish opus,A touching display of a feminist and a girl who must confront a astronaut in australia,1,4,2.99,125,22.99,R,"Trailers,deleted scenes,behind the scenes"
320,Flamingos connecticut,A fast-paced reflection of a composer and a composer who must meet a cat in the sahara desert,1,4,4.99,80,28.99,PG-13,Trailers
321,Flash wars,A astounding saga of a moose and a pastry chef who must chase a student in the gulf of mexico,1,3,4.99,123,21.99,NC-17,"Trailers,commentaries,behind the scenes"
322,Flatliners killer,A taut display of a secret agent and a waitress who must sink a robot in an abandoned mine shaft,1,5,2.99,100,29.99,G,"Trailers,commentaries,deleted scenes"
323,Flight lies,A stunning character study of a crocodile and a pioneer who must pursue a teacher in new orleans,1,7,4.99,179,22.99,R,Trailers
324,Flintstones happiness,A fateful story of a husband and a moose who must vanquish a boy in california,1,3,4.99,148,11.99,PG-13,"Trailers,commentaries,deleted scenes,behind the scenes"
325,Floats garden,A action-packed epistle of a robot and a car who must chase a boat in ancient japan,1,6,2.99,145,29.99,PG-13,"Trailers,commentaries,behind the scenes"
326,Flying hook,A thrilling display of a mad cow and a dog who must challenge a frisbee in nigeria,1,6,2.99,69,18.99,NC-17,"Trailers,commentaries,behind the scenes"
327,Fool mockingbird,A lacklusture tale of a crocodile and a composer who must defeat a madman in a u-boat,1,3,4.99,158,24.99,PG,"Trailers,commentaries"
328,Forever candidate,A unbelieveable panorama of a technical writer and a man who must pursue a frisbee in a u-boat,1,7,2.99,131,28.99,NC-17,"Commentaries,deleted scenes,behind the scenes"
329,Forrest sons,A thrilling documentary of a forensic psychologist and a butler who must defeat a explorer in a jet boat,1,4,2.99,63,15.99,R,Commentaries
330,Forrester comancheros,A fateful tale of a squirrel and a forensic psychologist who must redeem a man in nigeria,1,7,4.99,112,22.99,NC-17,"Trailers,behind the scenes"
331,Forward temple,A astounding display of a forensic psychologist and a mad scientist who must challenge a girl in new orleans,1,6,2.99,90,25.99,NC-17,"Trailers,commentaries,behind the scenes"
332,Frankenstein stranger,A insightful character study of a feminist and a pioneer who must pursue a pastry chef in nigeria,1,7,0.99,159,16.99,NC-17,"Deleted scenes,behind the scenes"
333,Freaky pocus,A fast-paced documentary of a pastry chef and a crocodile who must chase a squirrel in the gulf of mexico,1,7,2.99,126,16.99,R,"Trailers,behind the scenes"
334,Freddy storm,A intrepid saga of a man and a lumberjack who must vanquish a husband in the outback,1,6,4.99,65,21.99,NC-17,"Trailers,commentaries,behind the scenes"
335,Freedom cleopatra,A emotional reflection of a dentist and a mad cow who must face a squirrel in a baloon,1,5,0.99,133,23.99,PG-13,"Trailers,commentaries,behind the scenes"
336,French holiday,A thrilling epistle of a dog and a feminist who must kill a madman in berlin,1,5,4.99,99,22.99,PG,Behind the scenes
337,Frida slipper,A fateful story of a lumberjack and a car who must escape a boat in an abandoned mine shaft,1,6,2.99,73,11.99,R,"Trailers,deleted scenes"
338,Frisco forrest,A beautiful documentary of a woman and a pioneer who must pursue a mad scientist in a shark tank,1,6,4.99,51,23.99,PG,"Commentaries,deleted scenes,behind the scenes"
339,Frogmen breaking,A unbelieveable yarn of a mad scientist and a cat who must chase a lumberjack in australia,1,5,0.99,111,17.99,R,"Trailers,deleted scenes,behind the scenes"
340,Frontier cabin,A emotional story of a madman and a waitress who must battle a teacher in an abandoned fun house,1,6,4.99,183,14.99,PG-13,"Commentaries,deleted scenes"
341,Frost head,A amazing reflection of a lumberjack and a cat who must discover a husband in a mysql convention,1,5,0.99,82,13.99,PG,"Trailers,deleted scenes"
342,Fugitive maguire,A taut epistle of a feminist and a sumo wrestler who must battle a crocodile in australia,1,7,4.99,83,28.99,R,"Trailers,commentaries,deleted scenes"
343,Full flatliners,A beautiful documentary of a astronaut and a moose who must pursue a monkey in a shark tank,1,6,2.99,94,14.99,PG,"Trailers,deleted scenes"
344,Fury murder,A lacklusture reflection of a boat and a forensic psychologist who must fight a waitress in a monastery,1,3,0.99,178,28.99,PG-13,Deleted scenes
345,Gables metropolis,A fateful display of a cat and a pioneer who must challenge a pastry chef in a baloon factory,1,3,0.99,161,17.99,PG,"Trailers,commentaries"
346,Galaxy sweethearts,A emotional reflection of a womanizer and a pioneer who must face a squirrel in berlin,1,4,4.99,128,13.99,R,Deleted scenes
347,Games bowfinger,A astounding documentary of a butler and a explorer who must challenge a butler in a monastery,1,7,4.99,119,17.99,PG-13,Behind the scenes
348,Gandhi kwai,A thoughtful display of a mad scientist and a secret agent who must chase a boat in berlin,1,7,0.99,86,9.99,PG-13,Trailers
349,Gangs pride,A taut character study of a woman and a a shark who must confront a frisbee in berlin,1,4,2.99,185,27.99,PG-13,Behind the scenes
350,Garden island,A unbelieveable character study of a womanizer and a madman who must reach a man in the outback,1,3,4.99,80,21.99,G,"Trailers,behind the scenes"
351,Gaslight crusade,A amazing epistle of a boy and a astronaut who must redeem a man in the gulf of mexico,1,4,2.99,106,10.99,PG,"Trailers,deleted scenes"
352,Gathering calendar,A intrepid tale of a pioneer and a moose who must conquer a frisbee in a mysql convention,1,4,0.99,176,22.99,PG-13,"Commentaries,behind the scenes"
353,Gentlemen stage,A awe-inspiring reflection of a monkey and a student who must overcome a dentist in the first manned space station,1,6,2.99,125,22.99,NC-17,"Commentaries,deleted scenes"
354,Ghost groundhog,A brilliant panorama of a madman and a composer who must succumb a car in ancient india,1,6,4.99,85,18.99,G,"Trailers,commentaries,deleted scenes,behind the scenes"
355,Ghostbusters elf,A thoughtful epistle of a dog and a feminist who must chase a composer in berlin,1,7,0.99,101,18.99,R,"Trailers,deleted scenes,behind the scenes"
356,Giant troopers,A fateful display of a feminist and a monkey who must vanquish a monkey in the canadian rockies,1,5,2.99,102,10.99,R,"Trailers,commentaries"
357,Gilbert pelican,A fateful tale of a man and a feminist who must conquer a crocodile in a manhattan penthouse,1,7,0.99,114,13.99,G,"Trailers,commentaries"
358,Gilmore boiled,A unbelieveable documentary of a boat and a husband who must succumb a student in a u-boat,1,5,0.99,163,29.99,R,"Trailers,behind the scenes"
359,Gladiator westward,A astounding reflection of a squirrel and a sumo wrestler who must sink a dentist in ancient japan,1,6,4.99,173,20.99,PG,"Commentaries,deleted scenes"
360,Glass dying,A astounding drama of a frisbee and a astronaut who must fight a dog in ancient japan,1,4,0.99,103,24.99,G,Trailers
361,Gleaming jawbreaker,A amazing display of a composer and a forensic psychologist who must discover a car in the canadian rockies,1,5,2.99,89,25.99,NC-17,"Trailers,commentaries"
362,Glory tracy,A amazing saga of a woman and a womanizer who must discover a cat in the first manned space station,1,7,2.99,115,13.99,PG-13,"Trailers,commentaries,behind the scenes"
363,Go purple,A fast-paced display of a car and a database administrator who must battle a woman in a baloon,1,3,0.99,54,12.99,R,Trailers
364,Godfather diary,A stunning saga of a lumberjack and a squirrel who must chase a car in the outback,1,3,2.99,73,14.99,NC-17,Trailers
365,Gold river,A taut documentary of a database administrator and a waitress who must reach a mad scientist in a baloon factory,1,4,4.99,154,21.99,R,"Trailers,commentaries,deleted scenes,behind the scenes"
366,Goldfinger sensibility,A insightful drama of a mad scientist and a hunter who must defeat a pastry chef in new orleans,1,3,0.99,93,29.99,G,"Trailers,commentaries,behind the scenes"
367,Goldmine tycoon,A brilliant epistle of a composer and a frisbee who must conquer a husband in the outback,1,6,0.99,153,20.99,R,"Trailers,behind the scenes"
368,Gone trouble,A insightful character study of a mad cow and a forensic psychologist who must conquer a a shark in a manhattan penthouse,1,7,2.99,84,20.99,R,"Deleted scenes,behind the scenes"
369,Goodfellas salute,A unbelieveable tale of a dog and a explorer who must sink a mad cow in a baloon factory,1,4,4.99,56,22.99,PG,Deleted scenes
370,Gorgeous bingo,A action-packed display of a sumo wrestler and a car who must overcome a waitress in a baloon factory,1,4,2.99,108,26.99,R,"Deleted scenes,behind the scenes"
371,Gosford donnie,A epic panorama of a mad scientist and a monkey who must redeem a secret agent in berlin,1,5,4.99,129,17.99,G,Commentaries
372,Graceland dynamite,A taut display of a cat and a girl who must overcome a database administrator in new orleans,1,5,4.99,140,26.99,R,"Trailers,commentaries"
373,Graduate lord,A lacklusture epistle of a girl and a a shark who must meet a mad scientist in ancient china,1,7,2.99,156,14.99,G,"Trailers,behind the scenes"
374,Graffiti love,A unbelieveable epistle of a sumo wrestler and a hunter who must build a composer in berlin,1,3,0.99,117,29.99,PG,"Trailers,deleted scenes"
375,Grail frankenstein,A unbelieveable saga of a teacher and a monkey who must fight a girl in an abandoned mine shaft,1,4,2.99,85,17.99,NC-17,"Commentaries,deleted scenes,behind the scenes"
376,Grapes fury,A boring yarn of a mad cow and a sumo wrestler who must meet a robot in australia,1,4,0.99,155,20.99,G,"Commentaries,behind the scenes"
377,Grease youth,A emotional panorama of a secret agent and a waitress who must escape a composer in soviet georgia,1,7,0.99,135,20.99,G,"Trailers,deleted scenes"
378,Greatest north,A astounding character study of a secret agent and a robot who must build a a shark in berlin,1,5,2.99,93,24.99,NC-17,"Trailers,commentaries,behind the scenes"
379,Greedy roots,A amazing reflection of a a shark and a butler who must chase a hunter in the canadian rockies,1,7,0.99,166,14.99,R,"Trailers,commentaries,deleted scenes"
380,Greek everyone,A stunning display of a butler and a teacher who must confront a a shark in the first manned space station,1,7,2.99,176,11.99,PG,"Trailers,deleted scenes"
381,Grinch massage,A intrepid display of a madman and a feminist who must pursue a pioneer in the first manned space station,1,7,4.99,150,25.99,R,Trailers
382,Grit clockwork,A thoughtful display of a dentist and a squirrel who must confront a lumberjack in a shark tank,1,3,0.99,137,21.99,PG,"Trailers,deleted scenes"
383,Groove fiction,A unbelieveable reflection of a moose and a a shark who must defeat a lumberjack in an abandoned mine shaft,1,6,0.99,111,13.99,NC-17,Behind the scenes
384,Grosse wonderful,A epic drama of a cat and a explorer who must redeem a moose in australia,1,5,4.99,49,19.99,R,Behind the scenes
385,Groundhog uncut,A brilliant panorama of a astronaut and a technical writer who must discover a butler in a manhattan penthouse,1,6,4.99,139,26.99,PG-13,"Trailers,commentaries,deleted scenes,behind the scenes"
386,Gump date,A intrepid yarn of a explorer and a student who must kill a husband in an abandoned mine shaft,1,3,4.99,53,12.99,NC-17,Deleted scenes
387,Gun bonnie,A boring display of a sumo wrestler and a husband who must build a waitress in the gulf of mexico,1,7,0.99,100,27.99,G,Behind the scenes
388,Gunfight moon,A epic reflection of a pastry chef and a explorer who must reach a dentist in the sahara desert,1,5,0.99,70,16.99,NC-17,"Deleted scenes,behind the scenes"
389,Gunfighter mussolini,A touching saga of a robot and a boy who must kill a man in ancient japan,1,3,2.99,127,9.99,PG-13,"Trailers,commentaries"
390,Guys falcon,A boring story of a woman and a feminist who must redeem a squirrel in a u-boat,1,4,4.99,84,20.99,R,"Trailers,commentaries,behind the scenes"
391,Half outfield,A epic epistle of a database administrator and a crocodile who must face a madman in a jet boat,1,6,2.99,146,25.99,PG-13,"Trailers,commentaries,deleted scenes,behind the scenes"
392,Hall cassidy,A beautiful panorama of a pastry chef and a a shark who must battle a pioneer in soviet georgia,1,5,4.99,51,13.99,NC-17,"Commentaries,behind the scenes"
393,Halloween nuts,A amazing panorama of a forensic psychologist and a technical writer who must fight a dentist in a u-boat,1,6,2.99,47,19.99,PG-13,Deleted scenes
394,Hamlet wisdom,A touching reflection of a man and a man who must sink a robot in the outback,1,7,2.99,146,21.99,R,"Trailers,deleted scenes"
395,Handicap boondock,A beautiful display of a pioneer and a squirrel who must vanquish a sumo wrestler in soviet georgia,1,4,0.99,108,28.99,R,"Commentaries,deleted scenes,behind the scenes"
396,Hanging deep,A action-packed yarn of a boat and a crocodile who must build a monkey in berlin,1,5,4.99,62,18.99,G,"Trailers,commentaries,deleted scenes"
397,Hanky october,A boring epistle of a database administrator and a explorer who must pursue a madman in soviet georgia,1,5,2.99,107,26.99,NC-17,"Trailers,commentaries,deleted scenes"
398,Hanover galaxy,A stunning reflection of a girl and a secret agent who must succumb a boy in a mysql convention,1,5,4.99,47,21.99,NC-17,"Commentaries,deleted scenes,behind the scenes"
399,Happiness united,A action-packed panorama of a husband and a feminist who must meet a forensic psychologist in ancient japan,1,6,2.99,100,23.99,G,Deleted scenes
400,Hardly robbers,A emotional character study of a hunter and a car who must kill a woman in berlin,1,7,2.99,72,15.99,R,"Trailers,behind the scenes"
401,Harold french,A stunning saga of a sumo wrestler and a student who must outrace a moose in the sahara desert,1,6,0.99,168,10.99,NC-17,"Commentaries,deleted scenes,behind the scenes"
402,Harper dying,A awe-inspiring reflection of a woman and a cat who must confront a feminist in the sahara desert,1,3,0.99,52,15.99,G,Trailers
403,Harry idaho,A taut yarn of a technical writer and a feminist who must outrace a dog in california,1,5,4.99,121,18.99,PG-13,"Commentaries,deleted scenes"
404,Hate handicap,A intrepid reflection of a mad scientist and a pioneer who must overcome a hunter in the first manned space station,1,4,0.99,107,26.99,PG,"Trailers,commentaries,behind the scenes"
405,Haunted antitrust,A amazing saga of a man and a dentist who must reach a technical writer in ancient india,1,6,4.99,76,13.99,NC-17,"Trailers,deleted scenes"
406,Haunting pianist,A fast-paced story of a database administrator and a composer who must defeat a squirrel in an abandoned amusement park,1,5,0.99,181,22.99,R,Behind the scenes
407,Hawk chill,A action-packed drama of a mad scientist and a composer who must outgun a car in australia,1,5,0.99,47,12.99,PG-13,Behind the scenes
408,Head stranger,A thoughtful saga of a hunter and a crocodile who must confront a dog in the gulf of mexico,1,4,4.99,69,28.99,R,"Trailers,commentaries"
409,Heartbreakers bright,A awe-inspiring documentary of a a shark and a dentist who must outrace a pastry chef in the canadian rockies,1,3,4.99,59,9.99,G,"Trailers,deleted scenes"
410,Heaven freedom,A intrepid story of a butler and a car who must vanquish a man in new orleans,1,7,2.99,48,19.99,PG,Commentaries
411,Heavenly gun,A beautiful yarn of a forensic psychologist and a frisbee who must battle a moose in a jet boat,1,5,4.99,49,13.99,NC-17,Behind the scenes
412,Heavyweights beast,A unbelieveable story of a composer and a dog who must overcome a womanizer in an abandoned amusement park,1,6,4.99,102,25.99,G,Deleted scenes
413,Hedwig alter,A action-packed yarn of a womanizer and a lumberjack who must chase a sumo wrestler in a monastery,1,7,2.99,169,16.99,NC-17,"Trailers,commentaries,behind the scenes"
414,Hellfighters sierra,A taut reflection of a a shark and a dentist who must battle a boat in soviet georgia,1,3,2.99,75,23.99,PG,"Deleted scenes,behind the scenes"
415,High encino,A fateful saga of a waitress and a hunter who must outrace a sumo wrestler in australia,1,3,2.99,84,23.99,R,"Trailers,commentaries,behind the scenes"
416,Highball potter,A action-packed saga of a husband and a dog who must redeem a database administrator in the sahara desert,1,6,0.99,110,10.99,R,Deleted scenes
417,Hills neighbors,A epic display of a hunter and a feminist who must sink a car in a u-boat,1,5,0.99,93,29.99,G,"Trailers,commentaries,deleted scenes,behind the scenes"
418,Hobbit alien,A emotional drama of a husband and a girl who must outgun a composer in the first manned space station,1,5,0.99,157,27.99,PG-13,Commentaries
419,Hocus frida,A awe-inspiring tale of a girl and a madman who must outgun a student in a shark tank,1,4,2.99,141,19.99,G,"Trailers,deleted scenes,behind the scenes"
420,Holes brannigan,A fast-paced reflection of a technical writer and a student who must fight a boy in the canadian rockies,1,7,4.99,128,27.99,PG,"Commentaries,behind the scenes"
421,Holiday games,A insightful reflection of a waitress and a madman who must pursue a boy in ancient japan,1,7,4.99,78,10.99,PG-13,"Trailers,commentaries,behind the scenes"
422,Hollow jeopardy,A beautiful character study of a robot and a astronaut who must overcome a boat in a monastery,1,7,4.99,136,25.99,NC-17,Behind the scenes
423,Hollywood anonymous,A fast-paced epistle of a boy and a explorer who must escape a dog in a u-boat,1,7,0.99,69,29.99,PG,"Trailers,behind the scenes"
424,Holocaust highball,A awe-inspiring yarn of a composer and a man who must find a robot in soviet georgia,1,6,0.99,149,12.99,R,Deleted scenes
425,Holy tadpole,A action-packed display of a feminist and a pioneer who must pursue a dog in a baloon factory,1,6,0.99,88,20.99,R,Behind the scenes
426,Home pity,A touching panorama of a man and a secret agent who must challenge a teacher in a mysql convention,1,7,4.99,185,15.99,R,"Trailers,commentaries,behind the scenes"
427,Homeward cider,A taut reflection of a astronaut and a squirrel who must fight a squirrel in a manhattan penthouse,1,5,0.99,103,19.99,R,Trailers
428,Homicide peach,A astounding documentary of a hunter and a boy who must confront a boy in a mysql convention,1,6,2.99,141,21.99,PG-13,Commentaries
429,Honey ties,A taut story of a waitress and a crocodile who must outrace a lumberjack in a shark tank,1,3,0.99,84,29.99,R,"Trailers,commentaries,deleted scenes"
430,Hook chariots,A insightful story of a boy and a dog who must redeem a boy in australia,1,7,0.99,49,23.99,G,"Trailers,commentaries,behind the scenes"
431,Hoosiers birdcage,A astounding display of a explorer and a boat who must vanquish a car in the first manned space station,1,3,2.99,176,12.99,G,"Trailers,commentaries,deleted scenes"
432,Hope tootsie,A amazing documentary of a student and a sumo wrestler who must outgun a a shark in a shark tank,1,4,2.99,139,22.99,NC-17,"Trailers,deleted scenes,behind the scenes"
433,Horn working,A stunning display of a mad scientist and a technical writer who must succumb a monkey in a shark tank,1,4,2.99,95,23.99,PG,Trailers
434,Horror reign,A touching documentary of a a shark and a car who must build a husband in nigeria,1,3,0.99,139,25.99,R,"Deleted scenes,behind the scenes"
435,Hotel happiness,A thrilling yarn of a pastry chef and a a shark who must challenge a mad scientist in the outback,1,6,4.99,181,28.99,PG-13,Behind the scenes
436,Hours rage,A fateful story of a explorer and a feminist who must meet a technical writer in soviet georgia,1,4,0.99,122,14.99,NC-17,"Trailers,deleted scenes"
437,House dynamite,A taut story of a pioneer and a squirrel who must battle a student in soviet georgia,1,7,2.99,109,13.99,R,"Commentaries,deleted scenes,behind the scenes"
438,Human graffiti,A beautiful reflection of a womanizer and a sumo wrestler who must chase a database administrator in the gulf of mexico,1,3,2.99,68,22.99,NC-17,"Trailers,behind the scenes"
439,Hunchback impossible,A touching yarn of a frisbee and a dentist who must fight a composer in ancient japan,1,4,4.99,151,28.99,PG-13,"Trailers,deleted scenes"
440,Hunger roof,A unbelieveable yarn of a student and a database administrator who must outgun a husband in an abandoned mine shaft,1,6,0.99,105,21.99,G,"Deleted scenes,behind the scenes"
441,Hunter alter,A emotional drama of a mad cow and a boat who must redeem a secret agent in a shark tank,1,5,2.99,125,21.99,PG-13,"Commentaries,deleted scenes,behind the scenes"
442,Hunting musketeers,A thrilling reflection of a pioneer and a dentist who must outrace a womanizer in an abandoned mine shaft,1,6,2.99,65,24.99,NC-17,"Trailers,deleted scenes"
443,Hurricane affair,A lacklusture epistle of a database administrator and a woman who must meet a hunter in an abandoned mine shaft,1,6,2.99,49,11.99,PG,"Trailers,commentaries,behind the scenes"
444,Hustler party,A emotional reflection of a sumo wrestler and a monkey who must conquer a robot in the sahara desert,1,3,4.99,83,22.99,NC-17,"Trailers,commentaries,behind the scenes"
445,Hyde doctor,A fanciful documentary of a boy and a woman who must redeem a womanizer in a jet boat,1,5,2.99,100,11.99,G,"Trailers,deleted scenes"
446,Hysterical grail,A amazing saga of a madman and a dentist who must build a car in a manhattan penthouse,1,5,4.99,150,19.99,PG,"Trailers,commentaries,deleted scenes"
447,Ice crossing,A fast-paced tale of a butler and a moose who must overcome a pioneer in a manhattan penthouse,1,5,2.99,131,28.99,R,Deleted scenes
448,Idaho love,A fast-paced drama of a student and a crocodile who must meet a database administrator in the outback,1,3,2.99,172,25.99,PG-13,"Trailers,commentaries,deleted scenes,behind the scenes"
449,Identity lover,A boring tale of a composer and a mad cow who must defeat a car in the outback,1,4,2.99,119,12.99,PG-13,Deleted scenes
450,Idols snatchers,A insightful drama of a car and a composer who must fight a man in a monastery,1,5,2.99,84,29.99,NC-17,Trailers
451,Igby maker,A epic documentary of a hunter and a dog who must outgun a dog in a baloon factory,1,7,4.99,160,12.99,NC-17,"Trailers,behind the scenes"
452,Illusion amelie,A emotional epistle of a boat and a mad scientist who must outrace a robot in an abandoned mine shaft,1,4,0.99,122,15.99,R,"Commentaries,behind the scenes"
453,Image princess,A lacklusture panorama of a secret agent and a crocodile who must discover a madman in the canadian rockies,1,3,2.99,178,17.99,PG-13,"Trailers,commentaries,deleted scenes"
454,Impact aladdin,A epic character study of a frisbee and a moose who must outgun a technical writer in a shark tank,1,6,0.99,180,20.99,PG-13,"Trailers,deleted scenes"
455,Impossible prejudice,A awe-inspiring yarn of a monkey and a hunter who must chase a teacher in ancient china,1,7,4.99,103,11.99,NC-17,Deleted scenes
456,Inch jet,A fateful saga of a womanizer and a student who must defeat a butler in a monastery,1,6,4.99,167,18.99,NC-17,Deleted scenes
457,Independence hotel,A thrilling tale of a technical writer and a boy who must face a pioneer in a monastery,1,5,0.99,157,21.99,NC-17,"Trailers,behind the scenes"
458,Indian love,A insightful saga of a mad scientist and a mad scientist who must kill a astronaut in an abandoned fun house,1,4,0.99,135,26.99,NC-17,"Trailers,commentaries,deleted scenes,behind the scenes"
459,Informer double,A action-packed display of a woman and a dentist who must redeem a forensic psychologist in the canadian rockies,1,4,4.99,74,23.99,NC-17,"Trailers,commentaries"
460,Innocent usual,A beautiful drama of a pioneer and a crocodile who must challenge a student in the outback,1,3,4.99,178,26.99,PG-13,"Trailers,deleted scenes,behind the scenes"
461,Insects stone,A epic display of a butler and a dog who must vanquish a crocodile in a manhattan penthouse,1,3,0.99,123,14.99,NC-17,"Trailers,commentaries,behind the scenes"
462,Insider arizona,A astounding saga of a mad scientist and a hunter who must pursue a robot in a baloon factory,1,5,2.99,78,17.99,NC-17,Commentaries
463,Instinct airport,A touching documentary of a mad cow and a explorer who must confront a butler in a manhattan penthouse,1,4,2.99,116,21.99,PG,"Commentaries,deleted scenes"
