film_id,title,description,language_id,rental_duration,rental_rate,length,replacement_cost,rating,special_features
620,Nemo campus,A lacklusture reflection of a monkey and a squirrel who must outrace a womanizer in a manhattan penthouse,1,5,2.99,131,23.99,NC-17,Trailers
621,Network peak,A unbelieveable reflection of a butler and a boat who must outgun a mad scientist in california,1,5,2.99,75,23.99,PG-13,"Commentaries,deleted scenes,behind the scenes"
622,Newsies story,A action-packed character study of a dog and a lumberjack who must outrace a moose in the gulf of mexico,1,4,0.99,159,25.99,G,"Trailers,deleted scenes"
623,Newton labyrinth,A intrepid character study of a moose and a waitress who must find a a shark in ancient india,1,4,0.99,75,9.99,PG,"Trailers,commentaries,deleted scenes,behind the scenes"
624,Nightmare chill,A brilliant display of a robot and a butler who must fight a waitress in an abandoned mine shaft,1,3,4.99,149,25.99,PG,"Trailers,deleted scenes,behind the scenes"
625,None spiking,A boring reflection of a secret agent and a astronaut who must face a composer in a manhattan penthouse,1,3,0.99,83,18.99,NC-17,"Trailers,commentaries"
626,Noon papi,A unbelieveable character study of a mad scientist and a astronaut who must find a pioneer in a manhattan penthouse,1,5,2.99,57,12.99,G,Behind the scenes
627,North tequila,A beautiful character study of a mad cow and a robot who must reach a womanizer in new orleans,1,4,4.99,67,9.99,NC-17,"Commentaries,deleted scenes,behind the scenes"
628,Northwest polish,A boring character study of a boy and a a shark who must outrace a womanizer in the outback,1,5,2.99,172,24.99,PG,Trailers
629,Notorious reunion,A amazing epistle of a woman and a squirrel who must fight a hunter in a baloon,1,7,0.99,128,9.99,NC-17,"Trailers,commentaries,deleted scenes"
630,Notting speakeasy,A thoughtful display of a butler and a womanizer who must find a waitress in the canadian rockies,1,7,0.99,48,19.99,PG-13,"Trailers,commentaries"
631,Novocaine flight,A fanciful display of a student and a teacher who must outgun a crocodile in nigeria,1,4,0.99,64,11.99,G,"Trailers,commentaries,deleted scenes"
632,Nuts ties,A thoughtful drama of a explorer and a womanizer who must meet a teacher in california,1,5,4.99,145,10.99,NC-17,"Trailers,behind the scenes"
633,October submarine,A taut epistle of a monkey and a boy who must confront a husband in a jet boat,1,6,4.99,54,10.99,PG-13,"Trailers,commentaries,behind the scenes"
634,Odds boogie,A thrilling yarn of a feminist and a madman who must battle a hunter in berlin,1,6,0.99,48,14.99,NC-17,"Trailers,commentaries,behind the scenes"
635,Oklahoma jumanji,A thoughtful drama of a dentist and a womanizer who must meet a husband in the sahara desert,1,7,0.99,58,15.99,PG,Behind the scenes
636,Oleander clue,A boring story of a teacher and a monkey who must succumb a forensic psychologist in a jet boat,1,5,0.99,161,12.99,PG,"Commentaries,deleted scenes"
637,Open african,A lacklusture drama of a secret agent and a explorer who must discover a car in a u-boat,1,7,4.99,131,16.99,PG,"Trailers,commentaries"
638,Operation operation,A intrepid character study of a man and a frisbee who must overcome a madman in ancient china,1,7,2.99,156,23.99,G,"Trailers,commentaries,deleted scenes,behind the scenes"
639,Opposite necklace,A fateful epistle of a crocodile and a moose who must kill a explorer in nigeria,1,7,4.99,92,9.99,PG,Deleted scenes
640,Opus ice,A fast-paced drama of a hunter and a boy who must discover a feminist in the sahara desert,1,5,4.99,102,21.99,R,"Commentaries,deleted scenes"
641,Orange grapes,A astounding documentary of a butler and a womanizer who must face a dog in a u-boat,1,4,0.99,76,21.99,PG-13,"Trailers,commentaries"
642,Order betrayed,A amazing saga of a dog and a a shark who must challenge a cat in the sahara desert,1,7,2.99,120,13.99,PG-13,"Deleted scenes,behind the scenes"
643,Orient closer,A astounding epistle of a technical writer and a teacher who must fight a squirrel in the sahara desert,1,3,2.99,118,22.99,R,"Commentaries,deleted scenes"
644,Oscar gold,A insightful tale of a database administrator and a dog who must face a madman in soviet georgia,1,7,2.99,115,29.99,PG,Behind the scenes
645,Others soup,A lacklusture documentary of a mad cow and a madman who must sink a moose in the gulf of mexico,1,7,2.99,118,18.99,PG,Deleted scenes
646,Outbreak divine,A unbelieveable yarn of a database administrator and a woman who must succumb a a shark in a u-boat,1,6,0.99,169,12.99,NC-17,"Trailers,deleted scenes,behind the scenes"
647,Outfield massacre,A thoughtful drama of a husband and a secret agent who must pursue a database administrator in ancient india,1,4,0.99,129,18.99,NC-17,"Trailers,deleted scenes"
648,Outlaw hanky,A thoughtful story of a astronaut and a composer who must conquer a dog in the sahara desert,1,7,4.99,148,17.99,PG-13,"Trailers,commentaries"
649,Oz liaisons,A epic yarn of a mad scientist and a cat who must confront a womanizer in a baloon factory,1,4,2.99,85,14.99,R,"Commentaries,deleted scenes,behind the scenes"
650,Pacific amistad,A thrilling yarn of a dog and a moose who must kill a pastry chef in a manhattan penthouse,1,3,0.99,144,27.99,G,"Trailers,commentaries,deleted scenes,behind the scenes"
651,Packer madigan,A epic display of a sumo wrestler and a forensic psychologist who must build a woman in an abandoned amusement park,1,3,0.99,84,20.99,PG-13,Trailers
652,Pajama jawbreaker,A emotional drama of a boy and a technical writer who must redeem a sumo wrestler in california,1,3,0.99,126,14.99,R,"Trailers,deleted scenes"
653,Panic club,A fanciful display of a teacher and a crocodile who must succumb a girl in a baloon,1,3,4.99,102,15.99,G,"Commentaries,deleted scenes"
654,Panky submarine,A touching documentary of a dentist and a sumo wrestler who must overcome a boy in the gulf of mexico,1,4,4.99,93,19.99,G,"Trailers,commentaries,deleted scenes,behind the scenes"
655,Panther reds,A brilliant panorama of a moose and a man who must reach a teacher in the gulf of mexico,1,5,4.99,109,22.99,NC-17,"Deleted scenes,behind the scenes"
656,Papi necklace,A fanciful display of a car and a monkey who must escape a squirrel in ancient japan,1,3,0.99,128,9.99,PG,"Trailers,deleted scenes,behind the scenes"
657,Paradise sabrina,A intrepid yarn of a car and a moose who must outrace a crocodile in a manhattan penthouse,1,5,2.99,48,12.99,PG-13,"Commentaries,deleted scenes,behind the scenes"
658,Paris weekend,A intrepid story of a squirrel and a crocodile who must defeat a monkey in the outback,1,7,2.99,121,19.99,PG-13,"Trailers,commentaries,deleted scenes,behind the scenes"
659,Park citizen,A taut epistle of a sumo wrestler and a girl who must face a husband in ancient japan,1,3,4.99,109,14.99,PG-13,"Trailers,deleted scenes"
660,Party knock,A fateful display of a technical writer and a butler who must battle a sumo wrestler in an abandoned mine shaft,1,7,2.99,107,11.99,PG,"Trailers,behind the scenes"
661,Past suicides,A intrepid tale of a madman and a astronaut who must challenge a hunter in a monastery,1,5,4.99,157,17.99,PG-13,"Trailers,deleted scenes,behind the scenes"
662,Paths control,A astounding documentary of a butler and a cat who must find a frisbee in ancient china,1,3,4.99,118,9.99,PG,"Trailers,behind the scenes"
663,Patient sister,A emotional epistle of a squirrel and a robot who must confront a lumberjack in soviet georgia,1,7,0.99,99,29.99,NC-17,"Trailers,commentaries"
664,Patriot roman,A taut saga of a robot and a database administrator who must challenge a astronaut in california,1,6,2.99,65,12.99,PG,"Trailers,deleted scenes"
665,Patton interview,A thrilling documentary of a composer and a secret agent who must succumb a cat in berlin,1,4,2.99,175,22.99,PG,Commentaries
666,Paycheck wait,A awe-inspiring reflection of a boy and a man who must discover a moose in the sahara desert,1,4,4.99,145,27.99,PG-13,"Commentaries,deleted scenes"
667,Peach innocent,A action-packed drama of a monkey and a dentist who must chase a butler in berlin,1,3,2.99,160,20.99,PG-13,"Commentaries,behind the scenes"
668,Peak forever,A insightful reflection of a boat and a secret agent who must vanquish a astronaut in an abandoned mine shaft,1,7,4.99,80,25.99,PG,"Trailers,commentaries,deleted scenes,behind the scenes"
669,Pearl destiny,A lacklusture yarn of a astronaut and a pastry chef who must sink a dog in a u-boat,1,3,2.99,74,10.99,NC-17,Trailers
670,Pelican comforts,A epic documentary of a boy and a monkey who must pursue a astronaut in berlin,1,4,4.99,48,17.99,PG,"Commentaries,deleted scenes"
671,Perdition fargo,A fast-paced story of a car and a cat who must outgun a hunter in berlin,1,7,4.99,99,27.99,NC-17,"Trailers,behind the scenes"
672,Perfect groove,A thrilling yarn of a dog and a dog who must build a husband in a baloon,1,7,2.99,82,17.99,PG-13,"Commentaries,deleted scenes,behind the scenes"
673,Personal ladybugs,A epic saga of a hunter and a technical writer who must conquer a cat in ancient japan,1,3,0.99,118,19.99,PG-13,"Deleted scenes,behind the scenes"
674,Pet haunting,A unbelieveable reflection of a explorer and a boat who must conquer a woman in california,1,3,0.99,99,11.99,PG,"Trailers,commentaries"
675,Phantom glory,A beautiful documentary of a astronaut and a crocodile who must discover a madman in a monastery,1,6,2.99,60,17.99,NC-17,"Commentaries,behind the scenes"
676,Philadelphia wife,A taut yarn of a hunter and a astronaut who must conquer a database administrator in the sahara desert,1,7,4.99,137,16.99,PG-13,"Trailers,commentaries,deleted scenes"
677,Pianist outfield,A intrepid story of a boy and a technical writer who must pursue a lumberjack in a monastery,1,6,0.99,136,25.99,NC-17,"Trailers,commentaries,deleted scenes"
678,Pickup driving,A touching documentary of a husband and a boat who must meet a pastry chef in a baloon factory,1,3,2.99,77,23.99,G,"Trailers,commentaries,deleted scenes,behind the scenes"
679,Pilot hoosiers,A awe-inspiring reflection of a crocodile and a sumo wrestler who must meet a forensic psychologist in an abandoned mine shaft,1,6,2.99,50,17.99,PG,"Trailers,deleted scenes"
680,Pinocchio simon,A action-packed reflection of a mad scientist and a a shark who must find a feminist in california,1,4,4.99,103,21.99,PG,"Commentaries,behind the scenes"
681,Pirates roxanne,A stunning drama of a woman and a lumberjack who must overcome a a shark in the canadian rockies,1,4,0.99,100,20.99,PG,"Commentaries,deleted scenes"
682,Pittsburgh hunchback,A thrilling epistle of a boy and a boat who must find a student in soviet georgia,1,4,4.99,134,17.99,PG-13,"Trailers,deleted scenes,behind the scenes"
683,Pity bound,A boring panorama of a feminist and a moose who must defeat a database administrator in nigeria,1,5,4.99,60,19.99,NC-17,Commentaries
684,Pizza jumanji,A epic saga of a cat and a squirrel who must outgun a robot in a u-boat,1,4,2.99,173,11.99,NC-17,Commentaries
685,Platoon instinct,A thrilling panorama of a man and a woman who must reach a woman in australia,1,6,4.99,132,10.99,PG-13,"Trailers,commentaries"
686,Pluto oleander,A action-packed reflection of a car and a moose who must outgun a car in a shark tank,1,5,4.99,84,9.99,R,Behind the scenes
687,Pocus pulp,A intrepid yarn of a frisbee and a dog who must build a astronaut in a baloon factory,1,6,0.99,138,15.99,NC-17,"Commentaries,deleted scenes,behind the scenes"
688,Polish brooklyn,A boring character study of a database administrator and a lumberjack who must reach a madman in the outback,1,6,0.99,61,12.99,PG,"Trailers,commentaries,deleted scenes,behind the scenes"
689,Pollock deliverance,A intrepid story of a madman and a frisbee who must outgun a boat in the sahara desert,1,5,2.99,137,14.99,PG,Commentaries
690,Pond seattle,A stunning drama of a teacher and a boat who must battle a feminist in ancient china,1,7,2.99,185,25.99,PG-13,"Trailers,commentaries,behind the scenes"
691,Poseidon forever,A thoughtful epistle of a womanizer and a monkey who must vanquish a dentist in a monastery,1,6,4.99,159,29.99,PG-13,Commentaries
692,Potluck mixed,A beautiful story of a dog and a technical writer who must outgun a student in a baloon,1,3,2.99,179,10.99,G,Behind the scenes
693,Potter connecticut,A thrilling epistle of a frisbee and a cat who must fight a technical writer in berlin,1,5,2.99,115,16.99,PG,"Trailers,commentaries"
694,Prejudice oleander,A epic saga of a boy and a dentist who must outrace a madman in a u-boat,1,6,4.99,98,15.99,PG-13,"Trailers,commentaries,deleted scenes"
695,President bang,A fateful panorama of a technical writer and a moose who must battle a robot in soviet georgia,1,6,4.99,144,12.99,PG,Behind the scenes
696,Pride alamo,A thoughtful drama of a a shark and a forensic psychologist who must vanquish a student in ancient india,1,6,0.99,114,20.99,NC-17,Deleted scenes
697,Primary glass,A fateful documentary of a pastry chef and a butler who must build a dog in the canadian rockies,1,7,0.99,53,16.99,G,"Trailers,deleted scenes,behind the scenes"
698,Princess giant,A thrilling yarn of a pastry chef and a monkey who must battle a monkey in a shark tank,1,3,2.99,71,29.99,NC-17,"Trailers,deleted scenes"
699,Private drop,A stunning story of a technical writer and a hunter who must succumb a secret agent in a baloon,1,7,4.99,106,26.99,PG,Trailers
700,Prix undefeated,A stunning saga of a mad scientist and a boat who must overcome a dentist in ancient china,1,4,2.99,115,13.99,R,"Trailers,deleted scenes"
701,Psycho shrunk,A amazing panorama of a crocodile and a explorer who must fight a husband in nigeria,1,5,2.99,155,11.99,PG-13,Behind the scenes
702,Pulp beverly,A unbelieveable display of a dog and a crocodile who must outrace a man in nigeria,1,4,2.99,89,12.99,G,"Trailers,behind the scenes"
703,Punk divorce,A fast-paced tale of a pastry chef and a boat who must face a frisbee in the canadian rockies,1,6,4.99,100,18.99,PG,"Trailers,commentaries,deleted scenes"
704,Pure runner,A thoughtful documentary of a student and a madman who must challenge a squirrel in a manhattan penthouse,1,3,2.99,121,25.99,NC-17,"Trailers,deleted scenes"
705,Purple movie,A boring display of a pastry chef and a sumo wrestler who must discover a frisbee in an abandoned amusement park,1,4,2.99,88,9.99,R,"Commentaries,deleted scenes"
706,Queen luke,A astounding story of a girl and a boy who must challenge a composer in new orleans,1,5,4.99,163,22.99,PG,"Commentaries,deleted scenes,behind the scenes"
707,Quest mussolini,A fateful drama of a husband and a sumo wrestler who must battle a pastry chef in a baloon factory,1,5,2.99,177,29.99,R,Behind the scenes
708,Quills bull,A thoughtful story of a pioneer and a woman who must reach a moose in australia,1,4,4.99,112,19.99,R,"Trailers,behind the scenes"
709,Racer egg,A emotional display of a monkey and a waitress who must reach a secret agent in california,1,7,2.99,147,19.99,NC-17,"Trailers,commentaries,deleted scenes"
710,Rage games,A fast-paced saga of a astronaut and a secret agent who must escape a hunter in an abandoned amusement park,1,4,4.99,120,18.99,R,"Trailers,behind the scenes"
711,Raging airplane,A astounding display of a secret agent and a technical writer who must escape a mad scientist in a jet boat,1,4,4.99,154,18.99,R,"Commentaries,deleted scenes"
712,Raiders antitrust,A amazing drama of a teacher and a feminist who must meet a woman in the first manned space station,1,4,0.99,82,11.99,PG-13,Deleted scenes
713,Rainbow shock,A action-packed story of a hunter and a boy who must discover a lumberjack in ancient india,1,3,4.99,74,14.99,PG,"Trailers,commentaries,deleted scenes,behind the scenes"
714,Random go,A fateful drama of a frisbee and a student who must confront a cat in a shark tank,1,6,2.99,73,29.99,NC-17,Trailers
715,Range moonwalker,A insightful documentary of a hunter and a dentist who must confront a crocodile in a baloon,1,3,4.99,147,25.99,PG,"Trailers,commentaries,deleted scenes"
716,Reap unfaithful,A thrilling epistle of a composer and a sumo wrestler who must challenge a mad cow in a mysql convention,1,6,2.99,136,26.99,PG-13,"Trailers,commentaries"
717,Rear trading,A awe-inspiring reflection of a forensic psychologist and a secret agent who must succumb a pastry chef in soviet georgia,1,6,0.99,97,23.99,NC-17,"Trailers,commentaries,deleted scenes"
718,Rebel airport,A intrepid yarn of a database administrator and a boat who must outrace a husband in ancient india,1,7,0.99,73,24.99,G,"Trailers,behind the scenes"
719,Records zorro,A amazing drama of a mad scientist and a composer who must build a husband in the outback,1,7,4.99,182,11.99,PG,Behind the scenes
720,Redemption comforts,A emotional documentary of a dentist and a woman who must battle a mad scientist in ancient china,1,3,2.99,179,20.99,NC-17,"Trailers,deleted scenes,behind the scenes"
721,Reds pocus,A lacklusture yarn of a sumo wrestler and a squirrel who must redeem a monkey in soviet georgia,1,7,4.99,182,23.99,PG-13,"Trailers,behind the scenes"
722,Reef salute,A action-packed saga of a teacher and a lumberjack who must battle a dentist in a baloon,1,5,0.99,123,26.99,NC-17,Behind the scenes
723,Reign gentlemen,A emotional yarn of a composer and a man who must escape a butler in the gulf of mexico,1,3,2.99,82,29.99,PG-13,"Deleted scenes,behind the scenes"
724,Remember diary,A insightful tale of a technical writer and a waitress who must conquer a monkey in ancient india,1,5,2.99,110,15.99,R,"Trailers,commentaries"
725,Requiem tycoon,A unbelieveable character study of a cat and a database administrator who must pursue a teacher in a monastery,1,6,4.99,167,25.99,R,"Trailers,commentaries,behind the scenes"
726,Reservoir adaptation,A intrepid drama of a teacher and a moose who must kill a car in california,1,7,2.99,61,29.99,PG-13,Commentaries
727,Resurrection silverado,A epic yarn of a robot and a explorer who must challenge a girl in a mysql convention,1,6,0.99,117,12.99,PG,"Trailers,deleted scenes"
728,Reunion witches,A unbelieveable documentary of a database administrator and a frisbee who must redeem a mad scientist in a baloon factory,1,3,0.99,63,26.99,R,Commentaries
729,Rider caddyshack,A taut reflection of a monkey and a womanizer who must chase a moose in nigeria,1,5,2.99,177,28.99,PG,"Commentaries,behind the scenes"
730,Ridgemont submarine,A unbelieveable drama of a waitress and a composer who must sink a mad cow in ancient japan,1,3,0.99,46,28.99,PG-13,"Commentaries,deleted scenes,behind the scenes"
731,Right cranes,A fateful character study of a boat and a cat who must find a database administrator in a jet boat,1,7,4.99,153,29.99,PG-13,"Trailers,commentaries,deleted scenes"
732,Rings heartbreakers,A amazing yarn of a sumo wrestler and a boat who must conquer a waitress in new orleans,1,5,0.99,58,17.99,G,"Trailers,commentaries,behind the scenes"
733,River outlaw,A thrilling character study of a squirrel and a lumberjack who must face a hunter in a mysql convention,1,4,0.99,149,29.99,PG-13,Commentaries
734,Road roxanne,A boring character study of a waitress and a astronaut who must fight a crocodile in ancient japan,1,4,4.99,158,12.99,R,Behind the scenes
735,Robbers joon,A thoughtful story of a mad scientist and a waitress who must confront a forensic psychologist in soviet georgia,1,7,2.99,102,26.99,PG-13,Commentaries
736,Robbery bright,A taut reflection of a robot and a squirrel who must fight a boat in ancient japan,1,4,0.99,134,21.99,R,Trailers
737,Rock instinct,A astounding character study of a robot and a moose who must overcome a astronaut in ancient india,1,4,0.99,102,28.99,G,"Trailers,commentaries,deleted scenes,behind the scenes"
738,Rocketeer mother,A awe-inspiring character study of a robot and a sumo wrestler who must discover a womanizer in a shark tank,1,3,0.99,178,27.99,PG-13,"Deleted scenes,behind the scenes"
739,Rocky war,A fast-paced display of a squirrel and a explorer who must outgun a mad scientist in nigeria,1,4,4.99,145,17.99,PG-13,"Trailers,commentaries,behind the scenes"
740,Rollercoaster bringing,A beautiful drama of a robot and a lumberjack who must discover a technical writer in a shark tank,1,5,2.99,153,13.99,PG-13,"Trailers,commentaries,deleted scenes"
741,Roman punk,A thoughtful panorama of a mad cow and a student who must battle a forensic psychologist in berlin,1,7,0.99,81,28.99,NC-17,Trailers
742,Roof champion,A lacklusture reflection of a car and a explorer who must find a monkey in a baloon,1,7,0.99,101,25.99,R,"Deleted scenes,behind the scenes"
743,Room roman,A awe-inspiring panorama of a composer and a secret agent who must sink a composer in a shark tank,1,7,0.99,60,27.99,PG,"Trailers,deleted scenes,behind the scenes"
744,Roots remember,A brilliant drama of a mad cow and a hunter who must escape a hunter in berlin,1,4,0.99,89,23.99,PG-13,"Commentaries,deleted scenes,behind the scenes"
745,Roses treasure,A astounding panorama of a monkey and a secret agent who must defeat a woman in the first manned space station,1,5,4.99,162,23.99,PG-13,"Commentaries,deleted scenes,behind the scenes"
746,Rouge squad,A awe-inspiring drama of a astronaut and a frisbee who must conquer a mad scientist in australia,1,3,0.99,118,10.99,NC-17,"Commentaries,deleted scenes,behind the scenes"
747,Roxanne rebel,A astounding story of a pastry chef and a database administrator who must fight a man in the outback,1,5,0.99,171,9.99,R,"Deleted scenes,behind the scenes"
748,Rugrats shakespeare,A touching saga of a crocodile and a crocodile who must discover a technical writer in nigeria,1,4,0.99,109,16.99,PG-13,"Trailers,commentaries,deleted scenes,behind the scenes"
749,Rules human,A beautiful epistle of a astronaut and a student who must confront a monkey in an abandoned fun house,1,6,4.99,153,19.99,R,"Deleted scenes,behind the scenes"
750,Run pacific,A touching tale of a cat and a pastry chef who must conquer a pastry chef in a mysql convention,1,3,0.99,145,25.99,R,"Commentaries,deleted scenes,behind the scenes"
751,Runaway tenenbaums,A thoughtful documentary of a boat and a man who must meet a boat in an abandoned fun house,1,6,0.99,181,17.99,NC-17,Commentaries
752,Runner madigan,A thoughtful documentary of a crocodile and a robot who must outrace a womanizer in the outback,1,6,0.99,101,27.99,NC-17,"Commentaries,deleted scenes,behind the scenes"
753,Rush goodfellas,A emotional display of a man and a dentist who must challenge a squirrel in australia,1,3,0.99,48,20.99,PG,Deleted scenes
754,Rushmore mermaid,A boring story of a woman and a moose who must reach a husband in a shark tank,1,6,2.99,150,17.99,PG-13,"Trailers,commentaries,deleted scenes"
755,Sabrina midnight,A emotional story of a squirrel and a crocodile who must succumb a husband in the sahara desert,1,5,4.99,99,11.99,PG,"Trailers,behind the scenes"
756,Saddle antitrust,A stunning epistle of a feminist and a a shark who must battle a woman in an abandoned fun house,1,7,2.99,80,10.99,PG-13,"Trailers,deleted scenes"
757,Sagebrush clueless,A insightful story of a lumberjack and a hunter who must kill a boy in ancient japan,1,4,2.99,106,28.99,G,Trailers
758,Saints bride,A fateful tale of a technical writer and a composer who must pursue a explorer in the gulf of mexico,1,5,2.99,125,11.99,G,Deleted scenes
759,Salute apollo,A awe-inspiring character study of a boy and a feminist who must sink a crocodile in ancient china,1,4,2.99,73,29.99,R,"Trailers,commentaries,deleted scenes,behind the scenes"
760,Samurai lion,A fast-paced story of a pioneer and a astronaut who must reach a boat in a baloon,1,5,2.99,110,21.99,G,Commentaries
761,Santa paris,A emotional documentary of a moose and a car who must redeem a mad cow in a baloon factory,1,7,2.99,154,23.99,PG,"Commentaries,behind the scenes"
762,Sassy packer,A fast-paced documentary of a dog and a teacher who must find a moose in a manhattan penthouse,1,6,0.99,154,29.99,G,"Deleted scenes,behind the scenes"
763,Satisfaction confidential,A lacklusture yarn of a dentist and a butler who must meet a secret agent in ancient china,1,3,4.99,75,26.99,G,"Commentaries,deleted scenes,behind the scenes"
764,Saturday lambs,A thoughtful reflection of a mad scientist and a moose who must kill a husband in a baloon,1,3,4.99,150,28.99,G,"Commentaries,deleted scenes"
765,Saturn name,A fateful epistle of a butler and a boy who must redeem a teacher in berlin,1,7,4.99,182,18.99,R,"Trailers,commentaries,deleted scenes,behind the scenes"
766,Savannah town,A awe-inspiring tale of a astronaut and a database administrator who must chase a secret agent in the gulf of mexico,1,5,0.99,84,25.99,PG-13,"Commentaries,deleted scenes,behind the scenes"
767,Scalawag duck,A fateful reflection of a car and a teacher who must confront a waitress in a monastery,1,6,4.99,183,13.99,NC-17,"Commentaries,behind the scenes"
768,Scarface bang,A emotional yarn of a teacher and a girl who must find a teacher in a baloon factory,1,3,4.99,102,11.99,PG-13,"Commentaries,deleted scenes"
769,School jacket,A intrepid yarn of a monkey and a boy who must fight a composer in a manhattan penthouse,1,5,4.99,151,21.99,PG-13,Trailers
770,Scissorhands slums,A awe-inspiring drama of a girl and a technical writer who must meet a feminist in the canadian rockies,1,5,2.99,147,13.99,G,"Commentaries,deleted scenes,behind the scenes"
771,Scorpion apollo,A awe-inspiring documentary of a technical writer and a husband who must meet a monkey in an abandoned fun house,1,3,4.99,137,23.99,NC-17,"Commentaries,deleted scenes"
772,Sea virgin,A fast-paced documentary of a technical writer and a pastry chef who must escape a moose in a u-boat,1,4,2.99,80,24.99,PG,Deleted scenes
773,Seabiscuit punk,A insightful saga of a man and a forensic psychologist who must discover a mad cow in a mysql convention,1,6,2.99,112,28.99,NC-17,"Commentaries,deleted scenes,behind the scenes"
