film_id,title,description,language_id,rental_duration,rental_rate,length,replacement_cost,rating,special_features
464,Intentions empire,A astounding epistle of a cat and a cat who must conquer a mad cow in a u-boat,1,3,2.99,107,13.99,PG-13,"Trailers,behind the scenes"
465,Interview liaisons,A action-packed reflection of a student and a butler who must discover a database administrator in a manhattan penthouse,1,4,4.99,59,17.99,R,"Commentaries,behind the scenes"
466,Intolerable intentions,A awe-inspiring story of a monkey and a pastry chef who must succumb a womanizer in a mysql convention,1,6,4.99,63,20.99,PG-13,"Commentaries,behind the scenes"
467,Intrigue worst,A fanciful character study of a explorer and a mad scientist who must vanquish a squirrel in a jet boat,1,6,0.99,181,10.99,G,Deleted scenes
468,Invasion cyclone,A lacklusture character study of a mad scientist and a womanizer who must outrace a explorer in a monastery,1,5,2.99,97,12.99,PG,"Trailers,deleted scenes"
469,Iron moon,A fast-paced documentary of a mad cow and a boy who must pursue a dentist in a baloon,1,7,4.99,46,27.99,PG,"Commentaries,behind the scenes"
470,Ishtar rocketeer,A astounding saga of a dog and a squirrel who must conquer a dog in an abandoned fun house,1,4,4.99,79,24.99,R,"Trailers,commentaries,deleted scenes"
471,Island exorcist,A fanciful panorama of a technical writer and a boy who must find a dentist in an abandoned fun house,1,7,2.99,84,23.99,NC-17,"Trailers,commentaries"
472,Italian african,A astounding character study of a monkey and a moose who must outgun a cat in a u-boat,1,3,4.99,174,24.99,G,"Trailers,commentaries,deleted scenes"
473,Jacket frisco,A insightful reflection of a womanizer and a husband who must conquer a pastry chef in a baloon,1,5,2.99,181,16.99,PG-13,"Trailers,deleted scenes,behind the scenes"
474,Jade bunch,A insightful panorama of a squirrel and a mad cow who must confront a student in the first manned space station,1,6,2.99,174,21.99,NC-17,"Trailers,commentaries,behind the scenes"
475,Japanese run,A awe-inspiring epistle of a feminist and a girl who must sink a girl in the outback,1,6,0.99,135,29.99,G,Deleted scenes
476,Jason trap,A thoughtful tale of a woman and a a shark who must conquer a dog in a monastery,1,5,2.99,130,9.99,NC-17,"Trailers,deleted scenes,behind the scenes"
477,Jawbreaker brooklyn,A stunning reflection of a boat and a pastry chef who must succumb a a shark in a jet boat,1,5,0.99,118,15.99,PG,"Trailers,behind the scenes"
478,Jaws harry,A thrilling display of a database administrator and a monkey who must overcome a dog in an abandoned fun house,1,4,2.99,112,10.99,G,Deleted scenes
479,Jedi beneath,A astounding reflection of a explorer and a dentist who must pursue a student in nigeria,1,7,0.99,128,12.99,PG,"Trailers,commentaries,deleted scenes"
480,Jeepers wedding,A astounding display of a composer and a dog who must kill a pastry chef in soviet georgia,1,3,2.99,84,29.99,R,"Trailers,commentaries,deleted scenes"
481,Jekyll frogmen,A fanciful epistle of a student and a astronaut who must kill a waitress in a shark tank,1,4,2.99,58,22.99,PG,"Commentaries,deleted scenes,behind the scenes"
482,Jeopardy encino,A boring panorama of a man and a mad cow who must face a explorer in ancient india,1,3,0.99,102,12.99,R,"Trailers,commentaries"
483,Jericho mulan,A amazing yarn of a hunter and a butler who must defeat a boy in a jet boat,1,3,2.99,171,29.99,NC-17,Commentaries
484,Jerk paycheck,A touching character study of a pastry chef and a database administrator who must reach a a shark in ancient japan,1,3,2.99,172,13.99,NC-17,"Trailers,commentaries,deleted scenes,behind the scenes"
485,Jersey sassy,A lacklusture documentary of a madman and a mad cow who must find a feminist in ancient japan,1,6,4.99,60,16.99,PG,"Deleted scenes,behind the scenes"
486,Jet neighbors,A amazing display of a lumberjack and a teacher who must outrace a woman in a u-boat,1,7,4.99,59,14.99,R,"Trailers,commentaries,behind the scenes"
487,Jingle sagebrush,A epic character study of a feminist and a student who must meet a woman in a baloon,1,6,4.99,124,29.99,PG-13,"Trailers,commentaries"
488,Joon northwest,A thrilling panorama of a technical writer and a car who must discover a forensic psychologist in a shark tank,1,3,0.99,105,23.99,NC-17,"Trailers,commentaries,behind the scenes"
489,Juggler hardly,A epic story of a mad cow and a astronaut who must challenge a car in california,1,4,0.99,54,14.99,PG-13,"Trailers,commentaries"
490,Jumanji blade,A intrepid yarn of a husband and a womanizer who must pursue a mad scientist in new orleans,1,4,2.99,121,13.99,G,"Commentaries,behind the scenes"
491,Jumping wrath,A touching epistle of a monkey and a feminist who must discover a boat in berlin,1,4,0.99,74,18.99,NC-17,"Commentaries,behind the scenes"
492,Jungle closer,A boring character study of a boy and a woman who must battle a astronaut in australia,1,6,0.99,134,11.99,NC-17,"Trailers,commentaries,deleted scenes"
493,Kane exorcist,A epic documentary of a composer and a robot who must overcome a car in berlin,1,5,0.99,92,18.99,R,"Trailers,commentaries"
494,Karate moon,A astounding yarn of a womanizer and a dog who must reach a waitress in a mysql convention,1,4,0.99,120,21.99,PG-13,Behind the scenes
495,Kentuckian giant,A stunning yarn of a woman and a frisbee who must escape a waitress in a u-boat,1,5,2.99,169,10.99,PG,"Trailers,commentaries,deleted scenes,behind the scenes"
496,Kick savannah,A emotional drama of a monkey and a robot who must defeat a monkey in new orleans,1,3,0.99,179,10.99,PG-13,"Trailers,commentaries,deleted scenes"
497,Kill brotherhood,A touching display of a hunter and a secret agent who must redeem a husband in the outback,1,4,0.99,54,15.99,G,"Trailers,commentaries"
498,Killer innocent,A fanciful character study of a student and a explorer who must succumb a composer in an abandoned mine shaft,1,7,2.99,161,11.99,R,"Trailers,commentaries,deleted scenes"
499,King evolution,A action-packed tale of a boy and a lumberjack who must chase a madman in a baloon,1,3,4.99,184,24.99,NC-17,"Trailers,deleted scenes,behind the scenes"
500,Kiss glory,A lacklusture reflection of a girl and a husband who must find a robot in the canadian rockies,1,5,4.99,163,11.99,PG-13,"Trailers,commentaries,behind the scenes"
501,Kissing dolls,A insightful reflection of a pioneer and a teacher who must build a composer in the first manned space station,1,3,4.99,141,9.99,R,Trailers
502,Knock warlock,A unbelieveable story of a teacher and a boat who must confront a moose in a baloon,1,4,2.99,71,21.99,PG-13,Trailers
503,Kramer chocolate,A amazing yarn of a robot and a pastry chef who must redeem a mad scientist in the outback,1,3,2.99,171,24.99,R,Trailers
504,Kwai homeward,A amazing drama of a car and a squirrel who must pursue a car in soviet georgia,1,5,0.99,46,25.99,PG-13,"Trailers,commentaries"
505,Labyrinth league,A awe-inspiring saga of a composer and a frisbee who must succumb a pioneer in the sahara desert,1,6,2.99,46,24.99,PG-13,"Commentaries,behind the scenes"
506,Lady stage,A beautiful character study of a woman and a man who must pursue a explorer in a u-boat,1,4,4.99,67,14.99,PG,"Trailers,deleted scenes,behind the scenes"
507,Ladybugs armageddon,A fateful reflection of a dog and a mad scientist who must meet a mad scientist in new orleans,1,4,0.99,113,13.99,NC-17,Deleted scenes
508,Lambs cincinatti,A insightful story of a man and a feminist who must fight a composer in australia,1,6,4.99,144,18.99,PG-13,"Trailers,behind the scenes"
509,Language cowboy,A epic yarn of a cat and a madman who must vanquish a dentist in an abandoned amusement park,1,5,0.99,78,26.99,NC-17,"Trailers,deleted scenes"
510,Lawless vision,A insightful yarn of a boy and a sumo wrestler who must outgun a car in the outback,1,6,4.99,181,29.99,G,"Deleted scenes,behind the scenes"
511,Lawrence love,A fanciful yarn of a database administrator and a mad cow who must pursue a womanizer in berlin,1,7,0.99,175,23.99,NC-17,"Commentaries,deleted scenes,behind the scenes"
512,League hellfighters,A thoughtful saga of a a shark and a monkey who must outgun a student in ancient china,1,5,4.99,110,25.99,PG-13,Trailers
513,Leathernecks dwarfs,A fateful reflection of a dog and a mad cow who must outrace a teacher in an abandoned mine shaft,1,6,2.99,153,21.99,PG-13,"Trailers,commentaries,behind the scenes"
514,Lebowski soldiers,A beautiful epistle of a secret agent and a pioneer who must chase a astronaut in ancient china,1,6,2.99,69,17.99,PG-13,"Commentaries,deleted scenes"
515,Legally secretary,A astounding tale of a a shark and a moose who must meet a womanizer in the sahara desert,1,7,4.99,113,14.99,PG,"Trailers,commentaries,behind the scenes"
516,Legend jedi,A awe-inspiring epistle of a pioneer and a student who must outgun a crocodile in the outback,1,7,0.99,59,18.99,PG,"Commentaries,deleted scenes"
517,Lesson cleopatra,A emotional display of a man and a explorer who must build a boy in a manhattan penthouse,1,3,0.99,167,28.99,NC-17,"Deleted scenes,behind the scenes"
518,Liaisons sweet,A boring drama of a a shark and a explorer who must redeem a waitress in the canadian rockies,1,5,4.99,140,15.99,PG,"Commentaries,behind the scenes"
519,Liberty magnificent,A boring drama of a student and a cat who must sink a technical writer in a baloon,1,3,2.99,138,27.99,G,"Commentaries,deleted scenes,behind the scenes"
520,License weekend,A insightful story of a man and a husband who must overcome a madman in a monastery,1,7,2.99,91,28.99,NC-17,"Deleted scenes,behind the scenes"
521,Lies treatment,A fast-paced character study of a dentist and a moose who must defeat a composer in the first manned space station,1,7,4.99,147,28.99,NC-17,"Commentaries,deleted scenes,behind the scenes"
522,Life twisted,A thrilling reflection of a teacher and a composer who must find a man in the first manned space station,1,4,2.99,137,9.99,NC-17,"Commentaries,deleted scenes"
523,Lights deer,A unbelieveable epistle of a dog and a woman who must confront a moose in the gulf of mexico,1,7,0.99,174,21.99,R,Commentaries
524,Lion uncut,A intrepid display of a pastry chef and a cat who must kill a a shark in ancient china,1,6,0.99,50,13.99,PG,"Trailers,deleted scenes"
525,Loathing legally,A boring epistle of a pioneer and a mad scientist who must escape a frisbee in the gulf of mexico,1,4,0.99,140,29.99,R,Deleted scenes
526,Lock rear,A thoughtful character study of a squirrel and a technical writer who must outrace a student in ancient japan,1,7,2.99,120,10.99,R,"Trailers,commentaries"
527,Lola agent,A astounding tale of a mad scientist and a husband who must redeem a database administrator in ancient japan,1,4,4.99,85,24.99,PG,"Trailers,commentaries"
528,Lolita world,A thrilling drama of a girl and a robot who must redeem a waitress in an abandoned mine shaft,1,4,2.99,155,25.99,NC-17,"Trailers,deleted scenes"
529,Lonely elephant,A intrepid story of a student and a dog who must challenge a explorer in soviet georgia,1,3,2.99,67,12.99,G,"Trailers,commentaries,deleted scenes,behind the scenes"
530,Lord arizona,A action-packed display of a frisbee and a pastry chef who must pursue a crocodile in a jet boat,1,5,2.99,108,27.99,PG-13,Trailers
531,Lose inch,A stunning reflection of a student and a technical writer who must battle a butler in the first manned space station,1,3,0.99,137,18.99,R,"Trailers,commentaries"
532,Loser hustler,A stunning drama of a robot and a feminist who must outgun a butler in nigeria,1,5,4.99,80,28.99,PG,"Deleted scenes,behind the scenes"
533,Lost bird,A emotional character study of a robot and a a shark who must defeat a technical writer in a manhattan penthouse,1,4,2.99,98,21.99,PG-13,Deleted scenes
534,Louisiana harry,A lacklusture drama of a girl and a technical writer who must redeem a monkey in a shark tank,1,5,0.99,70,18.99,PG-13,Trailers
535,Love suicides,A brilliant panorama of a hunter and a explorer who must pursue a dentist in an abandoned fun house,1,6,0.99,181,21.99,R,"Trailers,behind the scenes"
536,Lovely jingle,A fanciful yarn of a crocodile and a forensic psychologist who must discover a crocodile in the outback,1,3,2.99,65,18.99,PG,"Trailers,behind the scenes"
537,Lover truman,A emotional yarn of a robot and a boy who must outgun a technical writer in a u-boat,1,3,2.99,75,29.99,G,Trailers
538,Loverboy attacks,A boring story of a car and a butler who must build a girl in soviet georgia,1,7,0.99,162,19.99,PG-13,"Trailers,behind the scenes"
539,Luck opus,A boring display of a moose and a squirrel who must outrace a teacher in a shark tank,1,7,2.99,152,21.99,NC-17,"Trailers,commentaries,behind the scenes"
540,Lucky flying,A lacklusture character study of a a shark and a man who must find a forensic psychologist in a u-boat,1,7,2.99,97,10.99,PG-13,"Trailers,commentaries,behind the scenes"
541,Luke mummy,A taut character study of a boy and a robot who must redeem a mad scientist in ancient india,1,5,2.99,74,21.99,NC-17,"Trailers,behind the scenes"
542,Lust lock,A fanciful panorama of a hunter and a dentist who must meet a secret agent in the sahara desert,1,3,2.99,52,28.99,G,"Trailers,commentaries,behind the scenes"
543,Madigan dorado,A astounding character study of a a shark and a a shark who must discover a crocodile in the outback,1,5,4.99,116,20.99,R,"Deleted scenes,behind the scenes"
544,Madison trap,A awe-inspiring reflection of a monkey and a dentist who must overcome a pioneer in a u-boat,1,4,2.99,147,11.99,R,"Commentaries,deleted scenes,behind the scenes"
545,Madness attacks,A fanciful tale of a squirrel and a boat who must defeat a crocodile in the gulf of mexico,1,4,0.99,178,14.99,PG-13,Trailers
546,Madre gables,A intrepid panorama of a sumo wrestler and a forensic psychologist who must discover a moose in the first manned space station,1,7,2.99,98,27.99,PG-13,"Trailers,commentaries,deleted scenes"
547,Magic mallrats,A touching documentary of a pastry chef and a pastry chef who must build a mad scientist in california,1,3,0.99,117,19.99,PG,"Trailers,commentaries"
548,Magnificent chitty,A insightful story of a teacher and a hunter who must face a mad cow in california,1,3,2.99,53,27.99,R,"Commentaries,deleted scenes"
549,Magnolia forrester,A thoughtful documentary of a composer and a explorer who must conquer a dentist in new orleans,1,4,0.99,171,28.99,PG-13,"Trailers,commentaries,deleted scenes"
550,Maguire apache,A fast-paced reflection of a waitress and a hunter who must defeat a forensic psychologist in a baloon,1,6,2.99,74,22.99,NC-17,"Trailers,commentaries"
551,Maiden home,A lacklusture saga of a moose and a teacher who must kill a forensic psychologist in a mysql convention,1,3,4.99,138,9.99,PG,Behind the scenes
552,Majestic floats,A thrilling character study of a moose and a student who must escape a butler in the first manned space station,1,5,0.99,130,15.99,PG,Trailers
553,Maker gables,A stunning display of a moose and a database administrator who must pursue a composer in a jet boat,1,4,0.99,136,12.99,PG-13,"Deleted scenes,behind the scenes"
554,Malkovich pet,A intrepid reflection of a waitress and a a shark who must kill a squirrel in the outback,1,6,2.99,159,22.99,G,Behind the scenes
555,Mallrats united,A thrilling yarn of a waitress and a dentist who must find a hunter in a monastery,1,4,0.99,133,25.99,PG,"Trailers,commentaries,deleted scenes"
556,Maltese hope,A fast-paced documentary of a crocodile and a sumo wrestler who must conquer a explorer in california,1,6,4.99,127,26.99,PG-13,Behind the scenes
557,Manchurian curtain,A stunning tale of a mad cow and a boy who must battle a boy in berlin,1,5,2.99,177,27.99,PG,"Trailers,commentaries"
558,Mannequin worst,A astounding saga of a mad cow and a pastry chef who must discover a husband in ancient india,1,3,2.99,71,18.99,PG-13,"Trailers,commentaries,deleted scenes"
559,Married go,A fanciful story of a womanizer and a dog who must face a forensic psychologist in the sahara desert,1,7,2.99,114,22.99,G,Behind the scenes
560,Mars roman,A boring drama of a car and a dog who must succumb a madman in soviet georgia,1,6,0.99,62,21.99,NC-17,"Commentaries,deleted scenes"
561,Mask peach,A boring character study of a student and a robot who must meet a woman in california,1,6,2.99,123,26.99,NC-17,"Commentaries,deleted scenes"
562,Masked bubble,A fanciful documentary of a pioneer and a boat who must pursue a pioneer in an abandoned mine shaft,1,6,0.99,151,12.99,PG-13,"Commentaries,behind the scenes"
563,Massacre usual,A fateful reflection of a waitress and a crocodile who must challenge a forensic psychologist in california,1,6,4.99,165,16.99,R,Commentaries
564,Massage image,A fateful drama of a frisbee and a crocodile who must vanquish a dog in the first manned space station,1,4,2.99,161,11.99,PG,"Commentaries,behind the scenes"
565,Matrix snowman,A action-packed saga of a womanizer and a woman who must overcome a student in california,1,6,4.99,56,9.99,PG-13,"Commentaries,deleted scenes,behind the scenes"
566,Maude mod,A beautiful documentary of a forensic psychologist and a cat who must reach a astronaut in nigeria,1,6,0.99,72,20.99,R,"Trailers,behind the scenes"
567,Meet chocolate,A boring documentary of a dentist and a butler who must confront a monkey in a mysql convention,1,3,2.99,80,26.99,G,Trailers
568,Memento zoolander,A touching epistle of a squirrel and a explorer who must redeem a pastry chef in the sahara desert,1,4,4.99,77,11.99,NC-17,Behind the scenes
569,Menagerie rushmore,A unbelieveable panorama of a composer and a butler who must overcome a database administrator in the first manned space station,1,7,2.99,147,18.99,G,"Trailers,commentaries,deleted scenes"
570,Mermaid insects,A lacklusture drama of a waitress and a husband who must fight a husband in california,1,5,4.99,104,20.99,NC-17,"Trailers,behind the scenes"
571,Metal armageddon,A thrilling display of a lumberjack and a crocodile who must meet a monkey in a baloon factory,1,6,2.99,161,26.99,PG-13,"Trailers,commentaries,deleted scenes"
572,Metropolis coma,A emotional saga of a database administrator and a pastry chef who must confront a teacher in a baloon factory,1,4,2.99,64,9.99,PG-13,"Trailers,commentaries,behind the scenes"
573,Microcosmos paradise,A touching character study of a boat and a student who must sink a a shark in nigeria,1,6,2.99,105,22.99,PG-13,Commentaries
574,Midnight westward,A taut reflection of a husband and a a shark who must redeem a pastry chef in a monastery,1,3,0.99,86,19.99,G,"Trailers,deleted scenes"
575,Midsummer groundhog,A fateful panorama of a moose and a dog who must chase a crocodile in ancient japan,1,3,4.99,48,27.99,G,"Trailers,deleted scenes"
576,Mighty luck,A astounding epistle of a mad scientist and a pioneer who must escape a database administrator in a mysql convention,1,7,2.99,122,13.99,PG,Behind the scenes
577,Mile mulan,A lacklusture epistle of a cat and a husband who must confront a boy in a mysql convention,1,4,0.99,64,10.99,PG,"Deleted scenes,behind the scenes"
578,Million ace,A brilliant documentary of a womanizer and a squirrel who must find a technical writer in the sahara desert,1,4,4.99,142,16.99,PG-13,Deleted scenes
579,Minds truman,A taut yarn of a mad scientist and a crocodile who must outgun a database administrator in a monastery,1,3,4.99,149,22.99,PG-13,"Deleted scenes,behind the scenes"
580,Mine titans,A amazing yarn of a robot and a womanizer who must discover a forensic psychologist in berlin,1,3,4.99,166,12.99,PG-13,"Trailers,deleted scenes"
581,Minority kiss,A insightful display of a lumberjack and a sumo wrestler who must meet a man in the outback,1,4,0.99,59,16.99,G,Trailers
582,Miracle virtual,A touching epistle of a butler and a boy who must find a mad scientist in the sahara desert,1,3,2.99,162,19.99,PG-13,"Trailers,deleted scenes"
583,Mission zoolander,A intrepid story of a sumo wrestler and a teacher who must meet a a shark in an abandoned fun house,1,3,4.99,164,26.99,PG-13,Behind the scenes
584,Mixed doors,A taut drama of a womanizer and a lumberjack who must succumb a pioneer in ancient india,1,6,2.99,180,26.99,PG-13,Behind the scenes
585,Mob duffel,A unbelieveable documentary of a frisbee and a boat who must meet a boy in the canadian rockies,1,4,0.99,105,25.99,G,Trailers
586,Mockingbird hollywood,A thoughtful panorama of a man and a car who must sink a composer in berlin,1,4,0.99,60,27.99,PG,Behind the scenes
587,Mod secretary,A boring documentary of a mad cow and a cat who must build a lumberjack in new orleans,1,6,4.99,77,20.99,NC-17,"Commentaries,behind the scenes"
588,Model fish,A beautiful panorama of a boat and a crocodile who must outrace a dog in australia,1,4,4.99,175,11.99,NC-17,"Trailers,commentaries,behind the scenes"
589,Modern dorado,A awe-inspiring story of a butler and a sumo wrestler who must redeem a boy in new orleans,1,3,0.99,74,20.99,PG,"Trailers,commentaries,deleted scenes"
590,Money harold,A touching tale of a explorer and a boat who must defeat a robot in australia,1,3,2.99,135,17.99,PG,"Trailers,commentaries"
591,Monsoon cause,A astounding tale of a crocodile and a car who must outrace a squirrel in a u-boat,1,6,4.99,182,20.99,PG,"Commentaries,behind the scenes"
592,Monster spartacus,A fast-paced story of a waitress and a cat who must fight a girl in australia,1,6,2.99,107,28.99,PG,"Commentaries,behind the scenes"
593,Monterey labyrinth,A awe-inspiring drama of a monkey and a composer who must escape a feminist in a u-boat,1,6,0.99,158,13.99,G,"Trailers,commentaries"
594,Montezuma command,A thrilling reflection of a waitress and a butler who must battle a butler in a jet boat,1,6,0.99,126,22.99,NC-17,Trailers
595,Moon bunch,A beautiful tale of a astronaut and a mad cow who must challenge a cat in a baloon factory,1,7,0.99,83,20.99,PG,"Deleted scenes,behind the scenes"
596,Moonshine cabin,A thoughtful display of a astronaut and a feminist who must chase a frisbee in a jet boat,1,4,4.99,171,25.99,PG-13,Behind the scenes
597,Moonwalker fool,A epic drama of a feminist and a pioneer who must sink a composer in new orleans,1,5,4.99,184,12.99,G,"Trailers,deleted scenes"
598,Mosquito armageddon,A thoughtful character study of a waitress and a feminist who must build a teacher in ancient japan,1,6,0.99,57,22.99,G,Trailers
599,Mother oleander,A boring tale of a husband and a boy who must fight a squirrel in ancient china,1,3,0.99,103,20.99,R,"Trailers,commentaries"
600,Motions details,A awe-inspiring reflection of a dog and a student who must kill a car in an abandoned fun house,1,5,0.99,166,16.99,PG,"Trailers,commentaries,behind the scenes"
601,Moulin wake,A astounding story of a forensic psychologist and a cat who must battle a teacher in an abandoned mine shaft,1,4,0.99,79,20.99,PG-13,Trailers
602,Mourning purple,A lacklusture display of a waitress and a lumberjack who must chase a pioneer in new orleans,1,5,0.99,146,14.99,PG,"Trailers,commentaries,deleted scenes,behind the scenes"
603,Movie shakespeare,A insightful display of a database administrator and a student who must build a hunter in berlin,1,6,4.99,53,27.99,PG,"Commentaries,deleted scenes,behind the scenes"
604,Mulan moon,A emotional saga of a womanizer and a pioneer who must overcome a dentist in a baloon,1,4,0.99,160,10.99,G,Behind the scenes
605,Mulholland beast,A awe-inspiring display of a husband and a squirrel who must battle a sumo wrestler in a jet boat,1,7,2.99,157,13.99,PG,"Trailers,deleted scenes,behind the scenes"
606,Mummy creatures,A fateful character study of a crocodile and a monkey who must meet a dentist in australia,1,3,0.99,160,15.99,NC-17,"Trailers,behind the scenes"
607,Muppet mile,A lacklusture story of a madman and a teacher who must kill a frisbee in the gulf of mexico,1,5,4.99,50,18.99,PG,"Trailers,deleted scenes"
608,Murder antitrust,A brilliant yarn of a car and a database administrator who must escape a boy in a mysql convention,1,6,2.99,166,11.99,PG,"Trailers,deleted scenes,behind the scenes"
609,Muscle bright,A stunning panorama of a sumo wrestler and a husband who must redeem a madman in ancient india,1,7,2.99,185,23.99,G,Deleted scenes
610,Music boondock,A thrilling tale of a butler and a astronaut who must battle a explorer in the first manned space station,1,7,0.99,129,17.99,R,"Trailers,commentaries,behind the scenes"
611,Musketeers wait,A touching yarn of a student and a moose who must fight a mad cow in australia,1,7,4.99,73,17.99,PG,"Deleted scenes,behind the scenes"
612,Mussolini spoilers,A thrilling display of a boat and a monkey who must meet a composer in ancient china,1,6,2.99,180,10.99,G,"Deleted scenes,behind the scenes"
613,Mystic truman,A epic yarn of a teacher and a hunter who must outgun a explorer in soviet georgia,1,5,0.99,92,19.99,NC-17,"Commentaries,behind the scenes"
614,Name detective,A touching saga of a sumo wrestler and a cat who must pursue a mad scientist in nigeria,1,5,4.99,178,11.99,PG-13,"Trailers,commentaries,behind the scenes"
615,Nash chocolat,A epic reflection of a monkey and a mad cow who must kill a forensic psychologist in an abandoned mine shaft,1,6,2.99,180,21.99,PG-13,"Commentaries,behind the scenes"
616,National story,A taut epistle of a mad scientist and a girl who must escape a monkey in california,1,4,2.99,92,19.99,NC-17,Trailers
617,Natural stock,A fast-paced story of a sumo wrestler and a girl who must defeat a car in a baloon factory,1,4,0.99,50,24.99,PG-13,"Commentaries,deleted scenes"
618,Necklace outbreak,A astounding epistle of a database administrator and a mad scientist who must pursue a cat in california,1,3,0.99,132,21.99,PG,"Trailers,commentaries,behind the scenes"
619,Neighbors charade,A fanciful reflection of a crocodile and a astronaut who must outrace a feminist in an abandoned amusement park,1,3,0.99,161,20.99,R,"Trailers,commentaries,deleted scenes"
